{
  "id": "pillars-foundation",
  "name": "أساس الأركان",
  "description": "أسئلة الأركان الخمسة في هذا الإصدار من البنك.",
  "questionIds": [
    "ha-1-1", "ha-1-2", "ha-2-1", "ha-2-2", "ha-3-1", "ha-3-2", "ha-4-1", "ha-4-2", "ha-5-1", "ha-5-2",
    "kid-sa-3", "kid-sh-3",
    "pg-1-1-1", "pg-1-1-2", "pg-1-1-3", "pg-1-1-4", "pg-1-1-5", "pg-1-1-6", "pg-1-2-1", "pg-1-2-2", "pg-1-2-3", "pg-1-2-4", "pg-1-2-6", "pg-1-3-1", "pg-1-3-4", "pg-1-3-5", "pg-1-4-1", "pg-1-4-2", "pg-1-4-4", "pg-1-4-5", "pg-1-4-6", "pg-1-5-1", "pg-1-5-2", "pg-1-5-4", "pg-1-5-5", "pg-1-5-6",
    "pg-2-1-3", "pg-2-1-4", "pg-2-1-5", "pg-2-2-2", "pg-2-2-3", "pg-2-2-4", "pg-2-2-5", "pg-2-2-6", "pg-2-3-1", "pg-2-3-2", "pg-2-3-3", "pg-2-3-4", "pg-2-3-6", "pg-2-4-1", "pg-2-4-2", "pg-2-4-3", "pg-2-4-4", "pg-2-4-5", "pg-2-4-6", "pg-2-5-1", "pg-2-5-2", "pg-2-5-3", "pg-2-5-4", "pg-2-5-5", "pg-2-5-6",
    "pg-3-1-2", "pg-3-1-3", "pg-3-1-4", "pg-3-1-5", "pg-3-2-1", "pg-3-2-2", "pg-3-2-4", "pg-3-2-5", "pg-3-2-6", "pg-3-3-1", "pg-3-3-3", "pg-3-3-4", "pg-3-3-5", "pg-3-3-6", "pg-3-4-2", "pg-3-4-3", "pg-3-4-4", "pg-3-4-5", "pg-3-4-6", "pg-3-5-1", "pg-3-5-2", "pg-3-5-3", "pg-3-5-4", "pg-3-5-5", "pg-3-5-6",
    "pg-4-1-2", "pg-4-1-3", "pg-4-1-6", "pg-4-2-1", "pg-4-2-3", "pg-4-2-4", "pg-4-2-5", "pg-4-2-6", "pg-4-3-1", "pg-4-3-2", "pg-4-3-3", "pg-4-3-4", "pg-4-3-5", "pg-4-3-6", "pg-4-4-1", "pg-4-4-2", "pg-4-4-3", "pg-4-4-4", "pg-4-4-5", "pg-4-4-6", "pg-4-5-1", "pg-4-5-2", "pg-4-5-3", "pg-4-5-5", "pg-4-5-6",
    "pg-5-1-1", "pg-5-1-4", "pg-5-1-6", "pg-5-2-2", "pg-5-2-3", "pg-5-2-4", "pg-5-2-5", "pg-5-2-6", "pg-5-3-2", "pg-5-3-5", "pg-5-3-6", "pg-5-4-1", "pg-5-4-2", "pg-5-4-3", "pg-5-4-4", "pg-5-4-6", "pg-5-5-1", "pg-5-5-2", "pg-5-5-4", "pg-5-5-5", "pg-5-5-6",
    "pk-1-1-1", "pk-1-1-2", "pk-1-2-1", "pk-1-2-2", "pk-1-3-1", "pk-1-3-2", "pk-1-4-1", "pk-1-4-2", "pk-1-5-1", "pk-1-5-2", "pk-2-1-1", "pk-2-1-2", "pk-2-2-1", "pk-2-2-2", "pk-2-3-1", "pk-2-3-2", "pk-2-4-1", "pk-2-4-2", "pk-2-5-1", "pk-2-5-2", "pk-3-1-1", "pk-3-1-2", "pk-3-2-1", "pk-3-2-2", "pk-3-3-1", "pk-3-3-2", "pk-3-4-1", "pk-3-4-2", "pk-3-5-1", "pk-3-5-2", "pk-4-1-1", "pk-4-1-2", "pk-4-2-1", "pk-4-2-2", "pk-4-3-1", "pk-4-3-2", "pk-4-4-1", "pk-4-4-2", "pk-4-5-1", "pk-4-5-2", "pk-5-1-1", "pk-5-1-2", "pk-5-2-1", "pk-5-2-2", "pk-5-3-1", "pk-5-3-2", "pk-5-4-1", "pk-5-4-2", "pk-5-5-1", "pk-5-5-2",
    "ps-1-1-1", "ps-1-1-2", "ps-1-2-1", "ps-1-2-2", "ps-1-3-1", "ps-1-3-2", "ps-1-4-1", "ps-1-4-2", "ps-1-5-1", "ps-1-5-2", "ps-2-1-1", "ps-2-1-2", "ps-2-2-1", "ps-2-2-2", "ps-2-3-1", "ps-2-3-2", "ps-2-4-1", "ps-2-4-2", "ps-2-5-1", "ps-2-5-2", "ps-3-1-1", "ps-3-1-2", "ps-3-2-1", "ps-3-2-2", "ps-3-3-1", "ps-3-3-2", "ps-3-4-1", "ps-3-4-2", "ps-3-5-1", "ps-3-5-2", "ps-4-1-1", "ps-4-1-2", "ps-4-2-1", "ps-4-2-2", "ps-4-3-1", "ps-4-3-2", "ps-4-4-1", "ps-4-4-2", "ps-4-5-1", "ps-4-5-2", "ps-5-1-1", "ps-5-1-2", "ps-5-2-1", "ps-5-2-2", "ps-5-3-1", "ps-5-3-2", "ps-5-4-1", "ps-5-4-2", "ps-5-5-1", "ps-5-5-2",
    "sa-1-1", "sa-1-2", "sa-2-1", "sa-2-2", "sa-3-1", "sa-3-2", "sa-4-1", "sa-4-2", "sa-5-1", "sa-5-2", "sh-1-1", "sh-1-2", "sh-2-2", "sh-3-1", "sh-3-2", "sh-4-2", "sh-5-1", "sh-5-2", "sw-1-1", "sw-1-2", "sw-2-1", "sw-2-2", "sw-3-1", "sw-3-2", "sw-4-1", "sw-4-2", "sw-5-1", "sw-5-2", "za-1-1", "za-1-2", "za-2-1", "za-2-2", "za-3-1", "za-3-2", "za-4-1", "za-4-2", "za-5-1", "za-5-2"
  ]
}
